<?xml version="1.0" encoding="UTF-8"?>
<xs:schema xmlns:xs="http://www.w3.org/2001/XMLSchema" elementFormDefault="qualified">

    <xs:element name="DSSV">
        <xs:complexType>
            <xs:sequence>
                <xs:element maxOccurs="unbounded" name="SinhVien">
                    <xs:complexType>
                        <xs:sequence>
                            <xs:element name="TenSV" type="xs:string"/>
                            <xs:element name="GioiTinh">
                                <xs:simpleType>
                                    <xs:restriction base="xs:string">
                                        <xs:enumeration value="Nam"/>
                                        <xs:enumeration value="Ná»¯"/>
                                    </xs:restriction>
                                </xs:simpleType>
                            </xs:element>
                            <xs:element name="NgaySinh" type="xs:date"/>
                            <xs:element name="MaLop">
                                <xs:simpleType>
                                    <xs:restriction base="xs:string">
                                        <xs:pattern value="[a-zA-Z]{4}[0-9]{2}"/>
                                    </xs:restriction>
                                </xs:simpleType>
                            </xs:element>
                        </xs:sequence>
                        <xs:attribute name="mssv">
                            <xs:simpleType>
                                <xs:restriction base="xs:string">
                                    <xs:length value="8"/>
                                </xs:restriction>
                            </xs:simpleType>
                        </xs:attribute>
                    </xs:complexType>
                </xs:element>
            </xs:sequence>
        </xs:complexType>
    </xs:element>
</xs:schema>
